review_id,product_id,title,author,rating,content,timestamp,profile_id,is_verified,helpful_count,product_attributes
RZSR6HETN19GU,B0CY6TTR3C,5.0 out of 5 stars Big sound in a portable package,James Donlon,5,"Easy setup like other Sonos experience. Very pleased that the sound is so full for a small speaker. Bought two of these so I can integrate with my other Sonos speakers, spreading sound around the house and on occasion outside. This speaker is great for such flexibility! I also put these two Roam 2 speakers in a stereo pair in a single room and am super impressed by the sound. Worth thinking about two of these as an alternative to more pricey Sonos options for your room. You will get pretty good sound plus flexibility/portability (at the expense of volume and depth of bass sound). Battery life is great, and I like the way the speakers sleep or power down when unplugged and idle for awhile, but stay up and awake if plugged in. The updated Sonos app keeps track of these even when powered off and picks them right up when powered on. Sonos is a great system and these Roam 2 speakers are a great addition for a portable option.","Reviewed in the United States July 27, 2024",AEKPQRCBV3DNLRZCMJSGQMSGSLAA,True,1,Color: Black
R3H92JQGC81CG3,B0CY6TTR3C,"5.0 out of 5 stars sound quality, light",Kiribiru,5,"great sound, and I love the shape, elegantfirst I was just looking for bluetooth speaker I went to the store and compared a bunch (Bose, jbl,ult etc....) and I liked the Bose the most but then I noticed this came out I decided to give It a shot, I like the sound more, lightness and the shapespeaker is plenty loud for being near it I cared more for sound quality than loudness because I just want to have something near me at highquality, even sitting outside I have it at 60% and its plantyI didn't care for wifi was thinking is it even worth it extra dollars for that but noticed I pretty much at home only use it over wifi, sonos app on my pixel phone, or airplay on my MacBooksomething I didn't understand its Trueplay I was like whatever its one of those gimmick things that you don't notice difference or subtle - I had it off I was outside and speaker seemed a little flat to me so I turned up the bass in sonos app, next morning I took it to the shower and I couldn't hear vocals because how strong bass was then I was like I should turn down the bass for closed space and then I was like wait lets turn Trueplay on, and it was perfect now I keep it on turns down bass in the bathroom so the sound is clear, and turns bass up outside so the speaker does not seem flat amazing this feature alone is such a game changeranyways I am keeping it and after so much research I am really satisfied that I put a little extra money","Reviewed in the United States May 23, 2024",AHACMARBEBMCS6ZOLMBFB4FY6QJA,True,20,Color: White
R1OS5DF32WEJSP,B0CY6TTR3C,"1.0 out of 5 stars Amazing Speaker, Horrible Experience",Matthew Keefe,1,"What can I say. I love Sonos, had the original PlayBar since it was released. Numerous speakers around the house, Sonos Move for outdoors and decided to pick up a Roam for travel. The speaker sounds amazing, especially for its size... however I can't add it to the Sonos ecosystem. Its a lone item, but whats worse is my other speakers are also missing from the mobile app now. I'm not alone in this, but unfortunately Sonos doesn't seem to care about it. Sadly this one will be going back, its too expensive for solely being a Bluetooth speaker.","Reviewed in the United States July 16, 2024",AFNZEBTUZMRH3OPVX7NYYD5ZH6SA,True,5,Color: Black
RZ3JZ2VUDV1OA,B0CY6TTR3C,4.0 out of 5 stars Underwhelming performance,M. Alvarez,4,"So, the positives right up front. Very small and portable. Simplistic but stylish. Easy to use and setup. Love the dedicated Bluetooth. Comes well packaged from Sonos. Very small and for its size, puts out good volume.Now the potential cons. I have a Sonos Arc and the Sonos Move (1st Gen). Got them both for a great sale price and the sound quality never ceases to impress me. Especially the Move, which even at very high volumes plays great music from rock, country and rap. I bought the roam to be more portable than my Move, which I use on the deck, poolside or at small gatherings. The Roam was more for hiking, beach trips and casual listening washing the car, etc. I have to say I am not impressed. It sounds decent at its highest volume although you can tell you’ve reached its limit. I never feel like any of my other Sonos products have hit a limit even at 100% volume. It also sounds almost flat and very mono sounding vs steep or simulated stereo. Worse, it’s okay with rock or country or anything that has very little bass, but don’t try and play any kind of rap or hip hip. The bass is almost non-existent and really makes it feel like you’re pushing the speakers beyond their capabilities.Granted, most small portable like this would have similar issues, but when I listen to my sons JBL Flip 5, which costs less than half the price, I feel like the bass is much richer and the sound is louder, but of relatively similar quality as the Sonos, which is very disappointing. Maybe I’m missing the mark on its intended use, but I don’t think so. For small sound and high portability, it’s okay, but feels overpriced when compared to a couple others for what it offers.Would have considered a slightly larger roam in its 2nd generation for larger speakers or drivers or a dedicated bass port. I’ll have to sample it for a while and along others. I’m on the fence keeping it vs returning it. I’ll update my decision later.UPDATE: okay, after using it down at the beach, I would have to say my opinion has changed some. While I still would like a bit more volume, it’s pretty good for small spaces and close to me or around the pool or campfire. Sound has grown on me for most music and I recognize what it is for its ultra portability. Battery life is good and it’s been easy to pair. Loud enough to enjoy, but not so loud as to annoy others around me at the beach. I bought it at full price for $179. If you wait for Prime Day or other major sales days, it drops to $143, which is a much more reasonable price where it’s worth it.","Reviewed in the United States July 8, 2024",AEFLVYVERRDW3B3YBXQF7SKRBXHA,True,7,Color: White
R2TKUNVXBRW239,B0CY6TTR3C,5.0 out of 5 stars Awesome product!,Amazon Customer,5,"This is a handy and quality speaker that is portable. I added it to my home system and its great because you can take it outside or on a hike, beach etc. and then bring it back and set on the charger.Great sound quality and nice compact speaker. It is a lot smaller than the Sono One speaker sets I have but nice for small corner, kitchen etc. when on the base charger.","Reviewed in the United States July 10, 2024",AFPIXNRCNG23YJANVUBFHDRLXRCA,True,0,Color: White
R2SQIZU6ZJGUX0,B0CY6TTR3C,5.0 out of 5 stars Probably What Version 1 Should Have Been,KayakUtah,5,"The sound quality is excellent. Setting up and connecting to my wireless network was painless. I was up and running including firmware updates within 2 to 3 minutes. I would have no complaints if this were my first Sonos product or my first Roam, but unfortunately, it isn't. I purchased the first Roam. Connectivity issues and sudden failures plagued it. Hopefully, these updates will correct all of the previous issues.","Reviewed in the United States June 1, 2024",AFWX5FLJCEQMCFEHIPD3MYQH4HYQ,True,8,Color: Black
R8REDZOTA6QX7,B0CY6TTR3C,"3.0 out of 5 stars Great sound, but not without flaws",Jason Rives,3,"I use this speaker for the shower, golf trips, and as a laptop speaker. Sounds great and nothing it's size I have heard is this crisp. Size is the key feature here so if you have more room for a larger portable speaker, then there are other options. Using it as a laptop speaker... well bluetooth takes at least 2 full minutes to click on each morning I start my day, so when I join my first meeting, people are talking and I can't hear anything. Biggest flaw, no matter what I do, Amazon Alexa will not connect to this speaker. I have sonos arc, sub, 300s, and a move 2 that are excellent and connected, but this little guy just hangs in the app with Connecting to Amazon. If you are using this as a smart speaker, look at different options.","Reviewed in the United States July 20, 2024",AFARNG7N5ZREPZQ5S43MH2J5ZURA,True,1,Color: Black
R1MTCMUNJXDWNA,B0CY6TTR3C,5.0 out of 5 stars Love this little speaker,Bevab,5,"Got this speaker because it’s waterproof and I can use it around the hot tub. I love it. It’s loud enough to hear over the jets, which is important because we listen to audiobooks. I also love that Alexa is built in. I can tell it to adjust volume, play music, or ask questions.","Reviewed in the United States July 25, 2024",AFCYZDBSA72ES47NZPZNLPNI5XYA,True,0,Color: White
R25ZDAM608ESGO,B0CY6TTR3C,4.0 out of 5 stars Great sound,OC4me,4,Hard to install once you figure out you need to uninstall what you have and start over.The sound is super good for such a small speaker.,"Reviewed in the United States July 22, 2024",AGLEOWARRXLR4SBDVTMNNNCA5ICQ,True,0,Color: White
RDQAT1UBC6SK7,B0CY6TTR3C,4.0 out of 5 stars Almost great,Chris,4,I love this speaker for its size and sound. It would be a five star product if it was a speakerphone.,"Reviewed in the United States July 23, 2024",AECEBLFK55KO4CPI53J27JFYJHCA,True,0,Color: Black
R28AG0KBQ8RCP2,B0CY6TTR3C,4.0 out of 5 stars Require app is glitchy,P. Rivers,4,"Speaker sounds great, but full functionality requires wifi connection. This version has improved bluetooth connectivity, but can do a stereo pair unless connected via wifi through their glitchy app. Well made and durable.","Reviewed in the United States June 15, 2024",AG2RTZ7V45JKDSXAKBYOL2A6DUIA,True,5,Color: Black
R3IYTW673C8QRR,B0CY6TTR3C,5.0 out of 5 stars Calidad,Facely,5,Bien hecho y con buena calidad de sonido mi única queja es que no sube mucho,"Reviewed in the United States August 3, 2024",AF2OROUQQQORPJL7GHB7JOT2JA5A,True,0,Color: Black
R26T4SW7G7UDTH,B0CY6TTR3C,5.0 out of 5 stars Great little speaker,Sanchez,5,"Happy with this Sonos speaker. Sound is great and it was easy to connect Bluetooth to my phone and to add it to my existing Sonos system. The Sonos app on the other hand still leaves a lot to be desired since their recent update debacle. But, all works well with this speaker and glad I made the investment - replaced a Amazon Tap and much happier with this product.","Reviewed in the United States July 3, 2024",AH2VCRQTQWQ3XVERAB6SANZAZ55A,True,1,Color: Black
R2MHQ3QUU28795,B0CY6TTR3C,5.0 out of 5 stars Sound is fabulous!,Amazon Customer,5,I use it to listen to my Pandora channels on my phone. The sound from the Sonos is so so so much better.,"Reviewed in the United States July 27, 2024",AFCUBDWJIFKVUYMOBPNTQYJXOG6Q,True,0,Color: White
R2VZWBIVDS35LC,B0CY6TTR3C,4.0 out of 5 stars Muy buena calidad ! Buena Marca !,Robin1961,4,Tengo que bajar la aplicación . Es muy bueno !,"Reviewed in the United States June 24, 2024",AGZAHUUFF57JDS4TXYVDXAPIOFCA,True,0,Color: White
R1WH8FQN16XBQW,B0CY6TTR3C,5.0 out of 5 stars Upgraded from original roam,sprint45,5,"Works perfect, took advantage of the prime sale to upgrade from the original roam.","Reviewed in the United States August 2, 2024",AH74V2NKRI67AT6TFDBS3EU6XSTA,True,0,Color: Black
R3670JPAPVCWPR,B0CY6TTR3C,5.0 out of 5 stars Incredible Bass!,Ross Hartung,5,"Love how compact it is with a full frequency spectrum, great for watching TV shows when my wife is sleeping as I can have the speaker right next to me, no more getting told to turn the TV down at night, reasonably priced. I can control all my Sonos speakers from my phone, very easy to use!","Reviewed in the United States July 1, 2024",AG6RTXZYSIWSEZWFGUQBOAAI6B2Q,True,1,Color: Black
R1MC610M3FY27O,B0CY6TTR3C,5.0 out of 5 stars Great deal.,Mark W.,5,The quality of sound this thing puts out is great. Good bass.,"Reviewed in the United States July 27, 2024",AGD7EGZ7IURUOQZ4AWTQFHNERTXQ,True,0,Color: White
R1GJG5OXK356V9,B0CY6TTR3C,5.0 out of 5 stars Perfect for golf cart and back patio,Mark Tichenor,5,Bought this for a small portable speaker for golf cart and back patio. Paired seamlessly with other Sonos speakers in the house. Fits perfectly with magnetic mount holder on my golf cart to add some music to golf practice on the course.,"Reviewed in the United States July 8, 2024",AH2TKFQCTBNCD26VK3VLV2WOX2QQ,True,1,Color: Black
R31C3HNWK8Y9XZ,B0CY6TTR3C,5.0 out of 5 stars Very easy to connect to I-phone,Amazon Customer,5,"Excellent product, plenty of volume for outside use.","Reviewed in the United States July 27, 2024",AGCWGHHYAXY6A7L7WVJFCPKDQYCA,True,0,Color: Black
R2ASHOZAFZSQ4S,B0CY6TTR3C,5.0 out of 5 stars Sound & clarity,Vanessa,5,Love this speaker! Excellent sound & clarity! You won’t regret it👌👌,"Reviewed in the United States July 25, 2024",AGBGJFV3XQYO7WXQWVN3TS2ZNWDA,True,0,Color: White
R1SWE2T6R0Y3W2,B0CY6TTR3C,"3.0 out of 5 stars Great sound, awful setup process",M. Bertrand,3,"The sound quality is great for its size, noticeably better than the old Amazon Tap it's replacing.However, the setup process was a nightmare using the Sonos app on Android. Initial pairing failed 3x in a row before finally succeeding on the 4th try. Setting up Amazon Alexa was even worse. The Sonos app kept hanging when trying to sign in w/Amazon. After I uninstalled the Amazon Shopping app, the Sonos app was finally able to sign in w/Amazon and complete the Alexa integration setup.5 stars for sound quality, 1 star for the setup process.","Reviewed in the United States June 23, 2024",AEWS6FRXILGAV2NJZF2YWJ5EXWMQ,True,6,Color: Black
R3T1413MSZ7USL,B0CY6TTR3C,5.0 out of 5 stars Packs a punch!,kuriouskoala,5,This speaker is incredible for traveling and listening to music while showering. The new layout of the buttons are much better and should been designed this way from the beginning. If you have a Sonos system already then this a great addition to pair it up and have music playing in another room,"Reviewed in the United States June 19, 2024",AFRAK2QTNYYE3LVHCUY7UR3RS25A,True,2,Color: White
RXCK7CTAB3Z0B,B0CY6TTR3C,5.0 out of 5 stars Sounds great,MusclyGeek,5,"The Roam 2 compares favorably to Apple HomePod and HomePod Mini. (Yes, I’m an Apple Fanboy. I worked at Apple for 13 years and love the quality and innovative design.) I guess the Roam 2 is brand new and I’m glad I gave it a shot (even with no ratings on Amazon). I wanted a waterproof AirPlay speaker to use in the shower or outdoors, and the Roam 2 delivers. Setup was slick and easy. Native SONOS app is impressive. I just got it today, so hopefully my experience will continue to impress.","Reviewed in the United States May 25, 2024",AGJUTNKNJOYWB425T7DHDIMPMU6A,True,4,Color: Black
R239JBOEB96UHX,B0CY6TTR3C,3.0 out of 5 stars Poor battery doesn't last more than 6 hours,Matt,3,Battery doesn't work for long,"Reviewed in the United States August 2, 2024",AG4YINWJT73AA2SMVLUW4UEJ5C5Q,True,0,Color: White
R26XMA3V252Y0N,B0CY6TTR3C,3.0 out of 5 stars Size in pics was misleading.,Robert Kammler,3,"I’m not sure whose hand they used for the pic on the website, but it must’ve been a toddler.The sound is good, especially for the size, but Bose is better and bigger for the price. The only advantage is you can pair it with your existing Sonos system.","Reviewed in the United States June 17, 2024",AGOQEIE32II3PWEL37EYENDXCYLQ,True,4,Color: White
R29CQKUH9IX84Q,B0CY6TTR3C,5.0 out of 5 stars Better than the Sonos Roam 1,Noah,5,I can immediately tell the connectivity is way better than the Roam 1 and the addition of the extra Bluetooth button has restored my sanity figuring out how to use it (which is a low bar to cross for any portable speaker). Happy with the upgrade thus far!,"Reviewed in the United States May 23, 2024",AGO45GVK437UE7TWQPFZVH7ZCDLQ,True,5,Color: Black
R256C71VGHJDG9,B0CY6TTR3C,"2.0 out of 5 stars Great Sound, worst app/speaker setup ever",J. Davenport,2,Hands down the worst experience I've ever had setting up a speaker.Had multiple errors 'setting up' speaker with current Sonos systemA nearly $200 speaker should just work. I've had better functionality and usage out of a $20 bluetooth speaker.Just read the apology letter sent out from the CEO for their 'May 7th Update'... nearly 3 months later.Sounds great (when it doesn't drop out; frequently)This is my last Sonos purchase.,"Reviewed in the United States July 25, 2024",AHE6C3FZW6WNTONXWVSFZNSZ7VFA,True,1,Color: Black
R1RCUCWF1S3XO7,B0CY6TTR3C,5.0 out of 5 stars Great sound…,Steven Tessler,5,Funky power button,"Reviewed in the United States June 10, 2024",AFP337EBTTQQGVFVSFZAZVFHVB5Q,True,1,Color: White
R3BCKKZJC9DGT,B0CY6TTR3C,2.0 out of 5 stars Disappointed you cannot use as a speaker/mic for FaceTime or other calls.,Mark Chriest,2,The speaker sounds great. The setup interface is easy. The big flaw is that this cannot function as a speaker/mic for phone calls or FaceTime calls. Kind of a big miss and really not even something I thought to check before buying. Every other speaker has that ability,"Reviewed in the United States June 24, 2024",AH2RW3DQUKDKSKQ6GCI4LMHD2BZQ,True,3,Color: Black
R1OXT1RPQAJG60,B0CY6TTR3C,"1.0 out of 5 stars Should be called ""Don't Roam""",OceanicOpps,1,"What is the point of having a BlueTooth speaker which you cannot Roam with? These sounded OK when on my countertop at home, but lo and behold when I took them in our RV they would not work. You could connect to one of them, but not both. In fact I could connect to both at the same time but I could only flip between them for output.What a joke! Even speakers 1/10th the cost allow you to connect multiple speakers via bluetooth and the so called king of connection Sonos cannot even make a Roam ROAM!If you want these in your home, get something that is less expensive, if you want them to roam, get something else. Long story short, Sonos lost my business forever.","Reviewed in the United States August 2, 2024",AHOQSAB4KP2DMFHHOH6WLC6XBHLA,True,0,Color: Black
R27YV94AZ877B3,B0CY6TTR3C,1.0 out of 5 stars Sonos is a mess,T Walsh,1,"This product showed up with no charger. So it’s essentially useless unless you order a separate charger.Also, Sonos recently decided to completely revamp their software and it’s a complete mess. There is also no way to use the equipment without the app. So now I have thousands of dollars worth of Sonos equipment around the house and it’s all been useless for weeks.Stay far away from Sonos! There are so many better options!","Reviewed in the United States July 27, 2024",AGZEE5KUXYIC5ALLXBZRJ7A7242A,True,2,Color: Black
R2DAM8AKATQG1D,B0CY6TTR3C,1.0 out of 5 stars Aweful app,Placeholder,1,Sonos destroyed my roam and all other speakers with a software update. I can’t even use my new roams. The company seems lost and unable to recover.,"Reviewed in the United States July 26, 2024",AHTLYHQKPID6UMAF33CRXODQJVNQ,True,1,Color: White
R1ANS7IKMB4U0S,B0CY6TTR3C,1.0 out of 5 stars Does not work with other Sonos speakers,Dominic Sauer,1,"It will not connect to the rest of my Sonia system. The app shows a constant error message. Based on the reviews here, it seems this is a common issue. Terrible product, and ever since Sonos updated their app, Sonos in general has sucked. If you’re looking at buying Sonos speakers, just don’t do it","Reviewed in the United States June 13, 2024",AHPGMPGMLQ5H2GJDB2444JIGKSNA,True,17,Color: Black
RMJNP14ENJLS4,B0CY6TTR3C,1.0 out of 5 stars Wtf,Tim Davis,1,I don’t know what Sonos has done but since they “upgraded” their system it is terrible. I bought the Roam 2 because I thought it would be a good addition to my existing system but it doesn’t connect half the time and I get a message to try again later. I want to hear my music NOW!,"Reviewed in the United States June 8, 2024",AHOBPPN6BTU2STCWDIWH2GBM4KGA,True,12,Color: Black
RVWAKG39KUY4S,B0CY6TTR3C,1.0 out of 5 stars Bluetooth,hemal,1,Thought connecting to bluetooth would be good in this version but it wasnt,"Reviewed in the United States June 26, 2024",AH6ZOQ65RLUFPQ7WBMWBWBXL4TSA,True,0,Color: Black
R2VJGR4ZI7H9B6,B0CY6TTR3C,"4.0 out of 5 stars Great sound, poor policy",E.Swope,4,"The sound quality on the Sonois Roam 2 is very very good. It has great tonality and an expansive sound stage, one which is tailored to your listening area. I have tried a lot of mobile blue tooth speakers, and this is one of the best in terms of audio quality, which is, absolutely, one of the most impot5rant factors, really the most important. I would compare it only to the Klipsch, B & O, Devialet.So why did I rate it 4 stars?1. I find it insulting or worse when a piece of equipment in this price range is so intrusive, puts so much effort into violating your privacy. Install the app and you will have none. I fully intend to uninstall rhe app. I may even do a full reset on my phone, but having installed it and created an accoujnt I asm already on a list they wil undoubtedly be selling.You can set up blue tooth without the app, but not wifi. Having connected to blue tooth I had to reset the speaker to install the app. It took me hou4rs, much like the B & O, which I was unhappy with for exactly the same reasons.*IF* you use th3 app you can not use a music player. I personally hate listening to music on my phone. In fact, I needed to make a call but couldn't because I was using the speaker, and it completely drained the battery on my phone. (Wifi and blue tooth will do that) make a call and could not because I was using the speaker. It also completely drained my phone's battery.2. Using a player would not have given me the benefits I get on many other blue tooth speakers because the Roam does not process lossless blue tooth codecs. You lose detail in transmission. Not everyone cares about this but most audiophile listeners do, so for a company of this quality, producing equipment in this price range, it is surprising and disappointing.No aptx, aptx hd or ldac.It does do some tricks if you have other Sonos speakers, like casting to the speaker in the next room.3. IPX rating questionable. The port is open, uncovered. I would not take this speaker to the beach, or even out ion the rain.With or without the app? The app does get you spatial tuning, BUT, besides issues already mentioned I lost the DAC on my FIIO, in addition to lossless blue tooth.In sum, the sound is very good but I feel that you pay a high price for it in terms of intrusiveness.I do not feel as though I would be sacrificing a great deal if I listened to my Klipsch instead, on my FIIO, weith location... turned off on my phone. We all have our priorities. Mine is most definitely sound quality, and this speaker do3es sound very good but I hzavwe to question some of their choices, to include not using lossless blue tooth codecs.","Reviewed in the United States June 18, 2024",AGASAFHLQKQP7RNG76TKN4GPBJBQ,False,0,Color: White
RU984OCJ1IVM6,B0CY6TTR3C,"3.0 out of 5 stars The hardware is great, but the SONOS app is horrible.",diamond dave,3,"SONOS Roam is a great little Bluetooth speaker. The size is easy to carry around, and it has really good sound for such a small form factor. The Alexa integration is also very good - you can power up the speaker and ask Alexa to play anything through connected services like Spotify or other music libraries and it does what you expect it to do - play music! The real let down is in in the recent overhaul of the Sonos app. Unfortunately, Sonos took a very good functioning S2 app and ruined it when they relaunched the app to handle the new Sonos Ace headphones. They've been working on re-adding features for the last two months and it's starting to improve, but very slowly. So buyer beware - you may want to wait until they get the app back to a more solid state before you jump into a Roam. However, the Roam does work well with Bluetooth and Airplay, so for now that's a great way to still play music.","Reviewed in the United States July 30, 2024",AH2NLQV3HKYPSPZJAU2FGCUV37GA,False,0,Color: Black
R34ZOX7VQX89KV,B0CY6TTR3C,4.0 out of 5 stars Great sound but took a while to set up.,Customer Review of Product,4,"This sounds really good, especially given the size. I use it strictly as a standalone speaker. I do not have a Sonos system. This took a while to set up with bluetooth, get the app running, etc., but it's been great. Batteries don't need charge as much as expected. Overall, I'm pleased with this choice.","Reviewed in the United States July 30, 2024",AEZT4HG44IGDNV27CFNZGAZ5E2WA,False,0,Color: Black
R1HEUYF9LJM6GR,B0CY6TTR3C,4.0 out of 5 stars Great sound and app capabilities,Tuam Lis,4,"This Sonos speaker is compact yet has great clarity. The app helps makes for a featured rich speaker. The unit did have some difficulty setting up and reconnecting to the phonw but it always easily reconnected to my home wifi without issue. Overall, the unit is simple in design and easy to transport.","Reviewed in the United States July 27, 2024",AEETJZIQWEQTMBPOKILEMGECTGBA,False,0,Color: White
